{
  "pr_number": 1,
  "what_changed": "Adds a foo connector and its bar sibling",
  "why": "Customer demand",
  "breaking": false,
  "doc_targets": [
    { "lens": "core", "action": "create", "page_hint": "connectors/foo.md" },
    { "lens": "core", "action": "create", "page_hint": "connectors/bar.md" }
  ],
  "notes": null
}
